Id,Genre,Title,Contents,Created at,Updated at
22,価値観,人間関係から受けるストレスが一番嫌い,"どうも、遅咲プログラマーの神里です。

僕は現在、プログラミングスクールとベンチャー企業で働いてるのですが、スクールの方は結構無駄なストレスが溜まります。

自分の記述ミスが原因でエラーが出てるのにひたすらパソコンのせいにしたり、勉強不足で基礎力が足りないのを講師のせいにしたり。

講師としてスクールで教えていると、そういった理不尽な理由が原因でクレームをつけられたりすることがたまにあります。

そして、そのときのストレスはめちゃくちゃ辛いです。

というかムカつきますw

で、そのストレスが溜まると、その日だけでなく、次の日にも影響が出たりします。

ムカつくことがずっと頭をよぎって、気分を切り替えるのに何度もエネルギーを使う。

僕はかなり神経質なので、このような人間関係から受けるストレスが一番嫌いです。

なので、できる限り人間関係から受けるストレスを減らせるように、これまでも約3年間副業に力を入れてきました。

もちろん最初からうまくいっていたわけではなく、月5万稼ぐのがやっとだっと時期もあります。

しかし、少しずつ収益が上がってきた結果、今では全く会社に行かなくても生活できるくらいのレベルにはなりました。

もちろん、僕のレベルなんてまだまだだし、月に500万、1000万、3000万稼ぐ人たちとは雲泥の差があります。

もっともっと精進していかなければいけません。

それでも、会社に行かなくて済むようになったのは、僕の人生の中ではとてもとても大きな革命です。

人間関係でめちゃくちゃ消耗しやすい僕は、ついに、余計な人間関係を切り離しても生きていける働き方を手に入れました。

なので、現在多大なストレスの原因になっているプログラミングスクールの講師も、もうそろそろ終わりにします。

これから先、僕が会社に所属して講師として働くことは二度とないでしょう。（もうやりたくないw）

こういう風に、ストレスの原因からフットワーク軽く逃げられるようになったのも、3年前に副業を始めておいたおかげです。

今になって、あの頃の自分には本当に感謝しています。

あの頃だと、副業をやる人はすごくマイノリティで、「副業=悪」とされているくらいでした。

実際に僕も、研究職の頃はマネージャーに注意されましたからね。

でも、「副業を辞めさせられるなら会社を辞めます」と伝え、それからずっと副業を辞めることはしませんでした。

その結果、社会との関わり方を大きく変えることができ、ネットからの収入だけで生活できるようになったわけです。

何が言いたいかというと、今、嫌なことがあるのであれば、それを避けても生きていける工夫をしたほうがいいということです。

もちろん「ストレスに耐える」という選択肢もありだとは思います。

ですが、それが原因で自分が体調を崩したり、周りの人に迷惑をかけたりするのは本末転倒です。

自分にとって居心地がいい場所をつくり、そこで最高のパフォーマンスを発揮して社会貢献すればいいんじゃない？

というのが僕の素直な意見です。

もし今、自分の心の声を犠牲にして嫌なことばかりをしているのであれば、もう一度自分の人生設計を見直してみてください。

本当に今やっていることがあなたの歩みたい人生なのか？

それをよく考えることが大切です。

僕は人間関係からくるストレスが大嫌いなので、あまり人と関わらなくても仕事ができるようにしました。

自分が生きやすい世界は、自分の手で構築する。

自分のわがままを実現できるのが、ビジネスで成果を出している人の特権です。

ぜひ、あなたが今抱えているストレスを排除できるよう、どう行動すればいいか考えてみてください。

楽しい経験を追い求めるより、まずは不快な経験を無くすことから。

そのほうがはるかに生活の質が向上しますよ。",2019-01-21 23:55:55 UTC,2019-01-21 23:55:55 UTC
23,自己投資,知っているか知らないかで結果が全く違う,"どうも、遅咲プログラマーの神里です。

あなたは勉強好きですか？

世間一般的には、「嫌い」と答える人が多そうですね。

でも、プログラマーをやるなら勉強を楽しむ姿勢はとても大切です。

答えを知っている人間の方が成果が出やすいのは誰もが知っている事実。

そして、プログラミングではその差がより顕著に現れます。

例えばこちらのコード

omikuji = [""大吉"", ""中吉"", ""小吉""]

puts omikuji[rand(omikuji.length)]

これは、おみくじをRubyで再現したものです。

初心者の方からすると、ちょっと複雑な処理ですよね。

でもそれが、sampleというメソッドを知っているとこうなります。

omikuji = [""大吉"", ""中吉"", ""小吉""]

puts omikuji.sample

これならかなりシンプルで、複雑な処理なんて考える必要ないですね。

sampleメソッドを知っているか知らないかの違いだけで、こんなにコードの簡潔さが変わるんです。

これはあくまでも簡単な例ですが、今回のように、知っていれば簡単なことでも知らないと途端にハードルが上がる、ということはたくさんあります。

ベテランプログラマーがやれば1分もかからないことでも、僕がやると1時間も2時間もかかったり。

そんなことが普通に起こりうるのがプログラマーの世界なんです。

なので、普段から勉強する姿勢を持つのはプログラマーとして超重要。

無駄な時間を増やさないためにも、頭の中にデータベースを構築しておく。

ただ、多くの方は「勉強=苦しいもの」というイメージを持ってますよね。

めっちゃ努力しないとできるようにならないんだ、みたいな。

しかし、それは大きな誤解です。

勉強は自分を苦しめるためにやるものではありません。

自分を楽にするためにやるものなんです。

普段から色んな情報に目を通し、自身の専門分野は深く掘り下げ、専門外の分野は広く浅く把握しておく。

そうやってどんどん頭を鍛え、悩む前から答えを知っていれば、実際に問題が起きたときにもすぐに解決することができます。

問題に直面したとき、悩んで悩んで解決した話は美化されがちですが、それよりも大切なのは悩む暇もなく問題を一瞬で解決すること。

プログラマーは、問題が起きても悩まなくて済むように、毎日勉強をしているわけです。（もちろん「楽しいから」というのが一番の理由ですが）

というわけで、知っているのと知らないのとでは、生産性が全く違ってくるということをよく頭に入れておいてください。

これはプログラミングだけではなく、ビジネスにおいても言えることです。

SEOを知っていれば集客はできるし、消費者心理を知っていれば物は売れる。

そうやってお金の稼ぎ方を知っている人はどんどん裕福になっていき、それを知らない人との差はどんどん広がっていきます。

「知っていれば簡単だけど、知らなければ難しい」

これはとても大切な価値観です。

そして、この価値観が活きる場面は人生の中で死ぬほどあります。

ぜひ、プログラマーにとって大切な価値観を身につけ、コンピュータだけでなく人生もハックしていってください。

効率を上げたいなら勉強あるのみ。",2019-01-21 23:56:24 UTC,2019-01-21 23:56:24 UTC
24,転職活動,Slackコミュ力の向上について,"現場で使用するコミュニケーションツールとしてはSlackがよく採用されます。

ちなみに、僕の現場もSlackです。

このように、現場ではコミュニケーションツールを使って仕事を進めていくことが多いわけですが、このSlackコミュ力についても未経験のうちから鍛えておいたほうがいいです。

そのほうが余計な仕事のミスもなくなるし、質問するときにも回答者が答えやすい質問ができる。

なので今のうちにSlackコミュ力を上げておきましょう！

そのためにまずやるべきことは、GitとGithub（もしくはBitbucket）の使い方を理解することです。

コミットしたソースコードをリモートリポジトリにプッシュしてそれを共有する。

最低限、これができるようになっていると、未経験の段階でも質問したときに明確な回答が得やすくなります。

次にやるべきは、検索能力を上げることですね。

知識が少ない最初のうちはどの検索ワードでググればいいかわからないと思いますが、基礎を学んだり色々ググったりしていくうちにどんどん使うべき検索ワードがわかるようになります。

「最初のうちは何が何だかわからなくて、自分なりの意見を持って質問できない」

という気持ちもよくわかりますが、だからといってずっとそのままでいいわけではないんです。

そういう甘えは捨てて、なにがなんでも自分なりの意見を持って質問するようにしましょう。

それが成長への近道です。

そのための練習としてがむしゃらにググるんです。

最初は大変かもしれませんが、慣れれば当然のようにググって質問することができるようになるので、ぜひ今のうちから検索能力を磨いておきましょう。

最後に、文章を読む人の気持ちを考える、ということについてお話します。

これがもう本当に重要で、できる限り読む人の負担を減らすように配慮することは常に考えた方がいいです。

読みにくい文章になっていないか？

結論から先に書いているか？

必要な情報を提供できているか？

礼儀を欠いた文章になってないか？

思考を相手に押し付けてないか？

きちんと感謝を伝えているか？

こちらから何かしらのGiveができているか？

とにかく相手の立場に立って考えるんです。

もちろんこれは簡単に身につくスキルではありません。

しかし、何度も何度も相手の気持ちを考えれば、だんだんとどのような文章を書けばいいのかがわかるようになります。

無駄に相手を不快にさせることがないよう、ぜひ１つ１つを意識してやってみてください。

このSlackコミュ力次第で、手に入る情報もだいぶ違ってきます。

自分の成長を加速させるためにも、ぜひ磨いていきましょう！

【注意】
もちろんコミュニケーションツールはSlackだけではありません。

Chatworkなるものもあります。

その場合はChatコミュ力とでも呼んでください。

追伸
良かったら感想をください。少しのアウトプットが成長につながります。",2019-01-21 23:56:54 UTC,2019-01-21 23:56:54 UTC
25,転職活動,週3勤務になってからの変化,"どうも、遅咲プログラマーの神里です。

週3勤務になってからというもの、1ヶ月の3分の2は休めるようになりました。

でね、こんだけ休みが多いと正直めっちゃダラけるんじゃないかと思ってたんですよ。

やっぱり会社の強制力って偉大じゃないですか。

で、実際、年末年始の連休は割としっかりダラけました。

沖縄そばと肉を食いまくりました。

ですが、それもピークが過ぎるとだんだん頭がビジネスモードに切り替わるようになったんです。

「もうそんな休みいらないわ」って感じで。

で、年始からはどんどん自分のビジネスに集中できるようになりました。

最近では、休みの日でも会社にいるのと変わらないくらいの労働時間になってます。

「フリーランスになるとセルフコントロールにめっちゃ不安がある」

という話をよく耳にしますが、休みもあり過ぎると慣れてくるのでそんなに心配ないと思いますよ。

むしろ会社員の頃よりもモチベーション高く仕事に取り組むことが出来るようになります。

僕はこの生活が好きすぎて、最近では通勤ゼロを目指すようになりました笑

まだまだフリーランスらしい生活は始まったばかりですが、これからもQOLを上げられるようにどんどん環境構築に取り組んでまいります。

沖縄帰るまでに、何とか通勤ゼロ生活を実現させたい。

まずはリモートワークで働けるところを色々探してみようかと思います。

まぁ、せっかく週3勤務になったので、皆さんがこれからチャレンジしようとしていることを先だって実践していけたら良いなと思っています。

それに関しては、知見がたまり次第、このLINE@でノウハウをどんどん共有していきますので楽しみにしていてください。

追伸
良かったら感想をください。少しのアウトプットが成長につながります。",2019-01-21 23:57:18 UTC,2019-01-21 23:57:18 UTC
26,自己投資,スキルを身につけるとやっぱり仕事には困らない,"どうも、遅咲プログラマーの神里です。

僕は年末に沖縄の実家に帰ってきたのですが、その帰省の間にさらっと沖縄での仕事が決まりました。

その決め手になったのが、プログラミングスキル、マーケティングスキル、人脈です。

正直、この3つが揃っていれば本当に仕事には困らないなと。

なぜなら、沖縄なんて仕事がないことでめちゃくちゃ有名ですからね。

僕自身、まさか地元でプログラマー兼ウェブマーケターとして働けるとは全く思ってませんでした。

でも、蓋を開けてみたらすんなり仕事が決まったんです。

肝心の時給は1300円。

これは東京の人からすると安いように感じるかもしれませんが、沖縄ではめっちゃ高いですね。

信頼を勝ち取る前からこの時給で働けるのは、価値あるスキルがあってこそ（もちろん僕はもっと上げてもらう予定ですが）

仕事の少ない地方に移住したいのであれば、やっぱりスキルは身につけた方がいいですよ。

そして、スキルを身につける方法として最も手っ取り早いのが、身につけたいスキルでビジネスを始めることです。

僕はプログラミングを始めて1ヶ月後には教育業を立ち上げ人に教えていました。

そのおかげでいままでずっとモチベーションを保つことができたし、お金を稼げるようにもなれたわけです。

人は、稼げる限り物事を辞めることはありません。

なぜなら続けていればどんどん生活が楽になるからです。

逆に、稼げなければどんどんモチベーションを失います。

どんな綺麗事言ったって、生活が苦しくなれば続けられなくなるのが人間ですからね。

なので、何か学びたいことがあるなら、そのスキルでビジネスを立ち上げましょう。

そして、それだけで生活できるようになりましょう。

月20万を自分のビジネスで稼ぐことくらい、1~2年あれば余裕でできますよ。

僕は2年で月70万程度を自分の力だけで稼げるようになりました。

人生変わると思えば、その期間くらい頑張るのは簡単です。

必死こいて大学受験の勉強をしていた時のモチベーションがあればいけるはず。（僕も高校生の時が人生で一番努力してました）

ここが人生のターニングポイントだと思って一生懸命スキルを身につけてみてください。

チャンスは目の前に転がっていますが、それを獲得できるかどうかはあなたの行動次第です。

自分に言い訳せず、しっかりと一歩ずつ前進していきましょう。

努力なくして成功はありません。

どんなに効率的な選択をしたとしても努力は必要です。

それを理解した上で楽しみながら前進できるのが結果を残す人です。

ぜひそこを目指して頑張ってみてください。

早いうちに人生の苦労を前倒ししましょう。

追伸
僕の教育業での収益推移はざっくりこんな感じです。

ビジネスを始めて
1ヶ月目　時給250円
2~6ヶ月目　時給500円
7~12ヶ月目　時給1000円
13ヶ月目　時給1600円
14ヶ月目以降　時給2000円以上

追伸2
良かったら感想をください。少しのアウトプットが成長につながります。",2019-01-21 23:58:14 UTC,2019-01-21 23:58:14 UTC
27,自己投資,プログラミング学習が飽きないようにするための工夫,"どうも、遅咲プログラマーの神里です。

今回はプログラミング学習が飽きないようにするための工夫について。

プログラミングって、勉強の仕方を工夫しないとすぐ飽きるんですよ。

ずっと同じ参考書使って勉強したり、ずっと同じエラーと格闘してたり、ずっと同じ言語勉強してたり。

で、そうやって飽きかけたときに僕が何をしてたのかというと、まずは気晴らしにプログラミング関連の色んな記事をネットサーフィンしていました。

特に、この方の記事は今でも結構読んでいますね。

伊藤淳一さん
https://qiita.com/jnchito

初心者の方は過去記事を片っ端から読むと、それだけでもかなり勉強になりますよ。

プログラマーになりたいなら、この方の記事を読みまくってみてください。

マジでレベル上がるので。

あとは、はてなブックマークのテクノロジーですね！

http://b.hatena.ne.jp/hotentry/it

こちらもトレンドの技術に関する記事が多くて面白い！

僕はプログラミングの勉強に飽きてきたら、こうやってテック系の記事を読みまくって息抜きしながら勉強してました。

それに、色んな記事読むといつの間にかモチベーション復活してるから面白い。

で、他の工夫としては言語をローテーションすることも心がけてましたね。

Railsプログラマーを目指すなら、Sass、Ruby、JavaScriptあたりをローテーションして学んでも良いんじゃないかな。

もちろん、最優先すべきはRubyなんだけど、それで飽きてしまうよりは息抜きに他の言語をやった方が何億倍もマシ。

結局色んな言語を学んでいた方が、相乗効果的な感じで理解も深まるので、相性のいい言語でローテーション組むのはオススメです。

あと他に飽きない工夫としては、自分の作りたいアプリをできる範囲で好き勝手作ってみたり、色んな技術書を買って読み漁ったりすることですね〜。

あと、単純に単価の高い案件を眺めるだけでもモチベーション上がったりします。

年始ということもあり、新たな挑戦が始まるということで心がウキウキしていると思いますが、モチベーションが下がるときは必ずやってきます。

なので、やる気のあるうちからやる気が出ない時のリスクヘッジをしておきましょう。

それが挫折を防ぐ秘訣です。

ぜひ楽しみながらプログラミング学習を続けていってください。

追伸
良かったら感想をください。少しのアウトプットが成長につながります。",2019-01-21 23:58:41 UTC,2019-01-21 23:58:41 UTC
28,収益化,地方にはお宝がいっぱい眠っている,"どうも、遅咲プログラマーの神里です。

僕は今、沖縄の実家で作業をしているのですが、やっぱり地方は情報発信において強みだらけだなと思いました。

食にしても芸能にしても、独自の文化が根付いていてネタが死ぬほどあります。

沖縄そば、とうふよう、カチャーシー、エイサーなど、発信したいことがたくさん。

本当に素晴らしい文化だなと思いました。

しかし、地元の人たちがWebマーケティングを知らないばかりに、たくさんの良い商品が埋もれてしまっているのが現状。

なので、4月に僕が沖縄に帰ってきたら、そこらへんのテコ入れをできればいいなとは思ってます。

で、ついこの間も母親の知り合いのお店に行ったら、そこでオーナーさんと仲良くなって、Webマーケティングやサイト制作でお手伝いをさせてもらえることになりました。

こんなにトントンと話が決まったのも、情報発信とプログラミングに力を入れてきていたおかげです。

コツコツやってきて本当に良かった。

というわけで、4月からそこで働くことになりそうですw

で、その職場でWebマーケティングのノウハウを教えて本当に売り上げが上がれば、そのノウハウを横展開し、同様に沖縄で埋もれているお店の売り上げをUPさせることもできるかと。

そこからどんどん自分の事業を大きくしていければ良いですね。

これからが本当に楽しみ。

僕が持っているスキルが地元の役に立てれば幸いです、とかそんな良い人っぽいことを言いたいわけではなく、単純に地元を自分のスキルで活性化させるのがめっちゃ楽しそう。

他の人にはないスキルを身につければ、社会貢献のハードルは下がりに下がってゲーム感覚になりますね。

というわけで、これからもただひたすら自分の人生をゲームのように楽しんでいこうと思います。

それでは、今年も宜しくお願いいたします。",2019-01-22 00:00:30 UTC,2019-01-22 00:00:30 UTC
